{
  "created_at": "2026-09-05T21:58:36.959431Z",
  "evidence_role": "STATISTICAL_RESULT",
  "locator": "chars:51-169",
  "schema_version": "3.0-post-p1p5-a",
  "source_document_id": "SD-3d624b96f0aa",
  "span_id": "ES-37d39b7f4b82",
  "span_integrity_status": "VERIFIED_EXACT_SUBSTRING",
  "text": "Cell-type-specific perturbation reduced the measured vasomotor response relative to the control condition (p = 0.004)."
}
